NON-DISCLOSURE AGREEMENT	0	x
clause.  Failure  to  comply  with  this  clause  shall  be  deemed  to  be  a	0	c
breach of this Agreement.	0	s
15.3  In  the  event  that  mediation  is  unsuccessful,  the  dispute  shall  be	0	c
resolved  either  by  reference  to  arbitration  or  by  court  proceedings  as	0	c
elected  by  either  party,  by  way  of  a  written  notice  to  the  other  party,	0	c
which  shall  state  the  specific  dispute  to  be  resolved  and  the  nature  of	0	c
such dispute.	0	s
15.4  Any  reference  to  arbitration  in  Singapore  shall  be  a  submission  to	0	c
arbitration within the meaning of the Arbitration Act for the time being in	0	c
force  in  Singapore.  Such  arbitration  shall  be  conducted  in  the  English	0	c
language  in  accordance  with  the  Arbitration  Rules  of  the  Singapore	0	c
International  Arbitration  Centre  (“SIAC  Rules”)  for  the  time  being  in	0	c
force, which rules are deemed to be incorporated by reference into this	0	c
clause,  except  in  so  far  as  such  Rules  conflict  with  the  provisions  of	0	c
Clause 14 herein, in which event the provisions of Clause 14 herein will	0	c
prevail.	0	s
AHPL Non-Disclosure Agreement                                10                                                    NDA_01012014	0	e
15.5  The arbitration tribunal shall consist of one (1) arbitrator to be appointed	0	c
by mutual agreement between the parties. Either party may propose to	0	c
the  other  the  name  or  names  of  one  or  more  persons,  one  of  whom	0	c
should  serve  as  an  arbitrator.  If  no  agreement  is  reached  within  thirty	0	c
(30) days  after receipt  by  one  party  of  such  a  proposal  from  the  other,	0	c
the arbitrator shall be appointed by the Appointing Authority.	0	s
15.6  The Appointing Authority shall be the Chairman of the SIAC.	0	s
15.7  The arbitrator must not be a present or former employee or agent of, or	0	c
consultant  or  counsel  to,  either  party  or  any  related  corporation  [as	0	c
defined in Section 6 of the Companies Act (Cap. 50)] of either party.	0	s
15.8  Any  decision  or  award  of  an  arbitration  tribunal  appointed  pursuant  to	0	c
this clause will be final and binding on the parties.	0	s
15.9  Interest  at  the  annual  rate  of  six  per  cent  (6%)  per  annum  will  be  due	0	c
and  payable  to  the  party  in  receipt  of  an  arbitration  award  from  such	0	c
date as the arbitral tribunal may decide until the date of payment to such	0	c
party.	0	s
15.10  The parties hereto undertake to keep the arbitration proceedings and all	0	c
information,  pleadings,  documents,  evidence  and  all  matters  relating	0	c
thereto confidential.	0	s
15.11  The  application  of  Part  II  of  the  International  Arbitration  Act,  and  the	0	c
Model Law referred thereto, to this Agreement is hereby excluded.	0	s
15.12  For the avoidance of doubt, it is agreed that nothing in Clause 14 shall	0	c
prevent  a  party  from  seeking  urgent  equitable  relief  before  any	0	c
appropriate  court  and  the  commencement  of  any  dispute  resolution	0	c
proceedings  shall  in  no  way  affect  the  continual  performance  of  the	0	c
parties’ obligations under this Agreement.	348	s
16.  PROFESSIONAL FEES	0	d
In  any  suit  or  other  proceeding  relating  to  the  subject  matter  of  the	0	c
Agreement,  the  prevailing  party  shall  be  entitled  to  recover  from  the	0	c
other  party  all  reasonable  costs,  fees  and  expenses  by  accountants,	0	c
solicitors and other professionals for services rendered to the prevailing	0	c
party  in  connection  with  the  suit  or  other  proceeding,  including  costs,	0	c
fees and expenses of preparation and appeal.	406	s
AHPL Non-Disclosure Agreement                                11                                                    NDA_01012014	0	e
17.  EXPORT CONTROL LAWS AND REGULATIONS	0	d
Each  party  agrees  to  comply  with  all  export  laws  and  regulations	0	c
(including  “deemed  export”  and  “deemed  re-export”  regulations)  of  the	0	c
United  States  and  any  other  relevant  local  export  laws  and  regulations	0	c
(“Export  Laws”)  to  ensure  that  no  data,  information,  program  and/or	0	c
deliverable  (or  direct  product  thereof)  is  (a)  exported,  directly  or	0	c
indirectly,  in  violation  of  Export  Laws;  or  (b)  used  for  any  purposes	0	c
prohibited  by  the  Export  Laws,  including  without  limitation,  nuclear,	0	c
chemical  or  biological  weapons  proliferation  or  development  of  missile	0	c
technology.	414	s
18.  ENTIRE AGREEMENT	0	d
18.1  The parties expressly acknowledge that they have read this Agreement	0	c
and  understood  its  provisions.  The  parties  agree  that  this  Agreement	0	c
and all Schedules annexed to the same constitute the entire agreement	0	c
between them with respect to the subject matter of this Agreement and	0	c
that it supersedes all prior or contemporaneous proposals, agreements,	0	c
negotiations,      representations,      warranties,      understandings,	0	c
correspondence  and  all  other  communications  (whether  written  or  oral,	0	c
express  or  implied)  or  arrangements  entered  into  between  the  parties	0	c
prior  to  this  Agreement  in  respect  of  the  matters  dealt  with  in  it.  No	0	c
promise,  inducement,  representation  or  agreement  other  than  as	0	c
expressly  set  forth  in  this  Agreement  has  been  made  to  or  by  the	0	c
parties.	424	s
19.  NO PARTNERSHIP	0	d
Nothing  contained  in  or  relating  to  this  Agreement  shall  be  deemed  to	0	c
constitute a partnership or agency relationship between the parties and	0	c
no party shall have any authority to act for or assume any obligation or	0	c
responsibility of any kind, express or implied on behalf of the other party	0	c
or  bind  or  commit  the  other  party  for  any  purpose  in  any  way	0	c
whatsoever.	437	s
20.  GOVERNING LAW	0	d
20.1  This Agreement  shall  be  deemed  to  be  made  in  Singapore,  subject  to,	0	c
governed  by  and  construed  in  all  respects  in  accordance  with  the  laws	0	c
of the Republic of Singapore for every intent and purpose.	0	s
20.2  The  parties  hereby  agree  to  submit  irrevocably  to  the  non-exclusive	0	c
jurisdiction of the Courts of the Republic of Singapore to settle any and	0	c
all disputes in connection with this Agreement.	444	s
AHPL Non-Disclosure Agreement                                12                                                    NDA_01012014	0	e
21.  MISCELLANEOUS	0	d
21.1  Words  incorporating  the  masculine  gender  only  shall  include  the	0	c
feminine and/or neuter genders and vice versa and words incorporating	0	c
the  singular  meaning  shall  include  the  plural  meaning  and  vice  versa	0	c
and  words  denoting  natural  persons  shall  include  bodies  corporate,	0	c
incorporate,  associated  partnerships,  firms,  trusts,  associations,  joint	0	c
ventures,  governments,  governmental  agencies  or  departments  or  any	0	c
other  entity,  and  all  such  words  shall  be  construed  interchangeably  in	0	c
that manner.	0	s
21.2  The  clauses,  paragraph  or  clause  headings  and  marginal  notes  in  this	0	c
Agreement are inserted for ease of reference and convenience only and	0	c
do not form part of this Agreement. They shall not be deemed to define,	0	c
limit, construe or describe the scope or intent of the clauses hereof nor	0	c
shall they in any way affect the interpretation of this Agreement.	0	s
21.3  References  to  clauses,  schedules  and  annexes  shall  be  references  to	0	c
Clauses  of  and  the  Schedules  and  Annexes  to  this  Agreement.  The	0	c
Schedules  and  Annexes  are  to  have  effect  and  be  construed  as  an	0	c
integral  part  of,  and  shall  be  deemed  to  be  incorporated  into,  this	0	c
Agreement.	0	s
21.4  References  to  statutory  provisions  shall  be  construed  as  references  to	0	c
those provisions as respectively amended, consolidated, extended or re-	0	c
enacted from time to time and all statutory instruments or orders made	0	c
pursuant to them.	0	s
21.5  Any  reference  to  “day”  shall  mean  a  period  of  twenty-four  (24)  hours,	0	c
ending at twelve (12) midnight.	0	s
21.6  If any period of time is specified from a given day, or the day of a given	0	c
act  or  event,  it  is  to  be  calculated  exclusive  of  that  day.  Where	0	c
expressed by reference to a person in Singapore, business day means	0	c
any  day  other  than  a  Saturday,  a  Sunday  or  a  day  on  which  licensed	0	c
banks are authorised or required to be closed in Singapore and, where	0	c
expressed  by  reference  to  the  jurisdiction  of  a  person  other  than	0	c
Singapore, means any day other than a Saturday, a Sunday or a day on	0	c
which  licensed  banks  are  authorised  or  required  to  be  closed  in  the	0	c
jurisdiction of that person,  then  that  time  limit  is deemed  to  only  expire	0	c
on the next business day.	0	s
21.7  References in this Agreement to anything which any party is required to	0	c
do  or  not  to  do  shall  include  its  acts,  defaults  and  omissions,  whether	0	c
direct or indirect, on its own account, or for or through any other person	0	c
AHPL Non-Disclosure Agreement                                13                                                    NDA_01012014	0	e
and  those  which  it  permits  or  suffers  to  be  done  or  not  done  by  any	0	c
other person.	0	s
21.8  In  the  event  of  a  conflict  between  any  of  the  terms  of  this  Agreement,	0	c
including its Schedules and Annexes, the conflict will be resolved in the	0	c
following  order  of  priority:  (1)  the  Clauses  of  this  Agreement;  (2)  the	0	c
Schedules and Annexes.	-1	s
********	0	e
AHPL Non-Disclosure Agreement                                14                                                    NDA_01012014	0	e
IN  WITNESS  WHEREOF  the  duly  authorised  representatives  of  the  parties	0	c
hereto  have  executed  this  Agreement  as  of  the  day  and  year  first  above	0	c
written.	-1	s
Signed By                                       }	0	x
for and on behalf of                          }	0	x
}	0	x
}	0	x
}	0	x
in the presence of:                          }	0	x
Designation                                   }	0	x
Signed By                                       }	0	x
for and on behalf of                          }	0	x
}	0	x
}	0	x
ALEXANDRA HEALTH PTE LTD        }	0	x
}	0	x
in the presence of:                          }	0	x
Designation                                   }	0	x
