NON-DISCLOSURE AGREEMENT	0	x
THIS  AGREEMENT  is  made  on  the  _________  day  of  _______________	0	c
2015 between _________________________________________, a company	0	c
incorporated  in  the  Republic  of  Singapore  and  having  its  registered  office  at	0	c
______________________________________________________________,	0	c
(hereinafter  referred  to  as  “the  Company”)  of  the  one  part  and  ALEXANDRA	0	c
HEALTH PTE LTD, a company incorporated in the Republic of Singapore and	0	c
having  its  registered  office  at  90  YISHUN  CENTRAL  SINGAPORE  768828	0	c
(hereinafter referred to as “AHPL”) of the other part.	0	s
WHEREAS:	0	d
(A)  The  parties,  for  their  mutual  benefit,  may  have  exchanged  and  wish  to	0	c
further  exchange  certain  information,  including  but  not  limited  to,  trade	0	c
secrets  and  proprietary  know-how  in  order  that  each  of  them  may	0	c
evaluate such information for the purpose of determining their respective	0	c
interests in establishing a business relationship between them.	0	s
(B)  The parties wish to define their rights with respect to the said information	0	c
and  to  protect  the  confidentiality  thereof  and  proprietary  features	0	c
contained therein.	0	s
(C)  The  Company  acknowledges  that  all  information  or  data  relating  to  the	0	c
Purpose  whether  in  writing,  orally  or  by  any  other  means  if  disclosed	0	c
(whether  directly  or  indirectly)  to  a  third  (3rd)  party  without  the  express	0	c
authorization of AHPL is highly confidential and would have a detrimental	0	c
effect  on  the  business  of  AHPL,  and  that  its  disclosure  could  not  only	0	c
expose  AHPL  to  liability  but  also  to  judicial  sanctions  and  that  such	0	c
disclosure might also adversely affect AHPL’s patients and under certain	0	c
circumstances, disclosure by the Company could expose the Company to	0	c
criminal  prosecution.  In  consideration  of  being  made  privy  to  the	0	c
Confidential Information, the Company hereby agrees to  observe and be	0	c
bound by the terms of the Agreement.	0	s
(D)  The  Company  acknowledges  that  all  information  or  data  relating  to	0	c
Purpose also applies to any organisation/institution that is related to AHPL	0	c
(i)  either  by  reason  of  AHPL  directly  or  indirectly  controlling  the	0	c
organisation/institution;   (ii)   by   reason   of   both  AHPL   and	0	c
organisation/institution being controlled by or under the common control of	0	c
a  third  party;  or  (iii)  by  reason  that  AHPL  is  obliged  to  provide  support	0	c
services  to  that  organisation/institution  for  any  reason.    In  the  context  of	0	c
corporate entities, a person “controls” the entity if it owns and controls (i)	0	c
more than fifty (50) percent of whose shares or other securities entitled to	0	c
AHPL Non-Disclosure Agreement                                1                                                    NDA_01012014	0	e
vote for election of directors (or other managing authority) in the entity, or	0	c
(ii) more than fifty (50) percent of the equity interest in the entity, or (iii) is	0	c
otherwise  able  to  direct  or  cause  the  direction  of  the  management  and	0	c
policies of such person or entity whether by contract or otherwise.	10	s
NOW IT IS HEREBY AGREED AS FOLLOWS:	0	d
1.     DEFINITIONS	0	d
In  this  Agreement,  the  following  expressions  shall  have  the  following	0	c
meanings:	0	d
1.1   'Purpose'  shall  mean  any  discussions  and  negotiations  between  or	0	c
within the parties concerning or in connection with the establishment of	0	c
a business relationship between the parties.	0	s
1.2	0	d
(a)      'Confidential Information' shall mean all information received from the	0	c
other  party  which  the  latter  has  indicated  in  writing  or  labelled  to  be	0	c
“Confidential”,  “Proprietary  Information”  or  with  any  other  comparable	0	c
legend  to  similar  effect,  at  the  time  of  disclosure  [or  if  disclosed  orally,	0	c
confirmed  in  writing  by  the  disclosing  party  as  such  within  fifteen  (15)	0	c
days  after  its  disclosure],  which  it  may  acquire  in  relation  to  the  other	0	c
party, including but without any limitation whatsoever:	0	d
(i)     all commercial, marketing and business information, strategic and	0	c
development  plans,  intentions,  any  matter  concerning  AHPL,  its	0	c
affairs,  business,  operations,  shareholders,  directors,  officers,	0	c
business associates, clients or any other person or entity having	0	c
dealings with AHPL;	0	s
(ii)    information  relating  to  the  financial  condition  of  AHPL,  its	0	c
accounts,  audited  or  otherwise,  notes,  memoranda,  documents	0	c
and/or  records  in  any  form  whatsoever,  whether  electronic  or	0	c
otherwise; and	0	s
(iii)    scientific,  technical,  intellectual  or  other  information  in  any  form	0	c
whatsoever, whether electronic or otherwise, relating to methods,	0	c
processes, formulae, compositions, systems, techniques, product	0	c
information,  inventions,  know-how,  trade  secrets,  design  rights,	0	c
machines, computer programs, software, development codes and	0	c
research  projects;  business  plans,  co-developer/collaborator	0	c
identities,  data,  business  records  of  every  nature,  customer  lists	0	c
and client database, pricing data, project records, market reports,	0	c
sources of supply, employee lists, business manuals, policies and	0	c
procedures, information relating to technologies or theory and all	0	c
AHPL Non-Disclosure Agreement                                2                                                    NDA_01012014	0	e
other  information  which  may  be  disclosed  by  AHPL  to  the  other	0	c
party  which  the  other  party  may  be  provided  access  by  AHPL,	0	c
whether stored electronically or otherwise; all information which is	0	c
deemed  by  AHPL  to  be  Confidential  Information  or  which  is	0	c
generated  as  a  result  of  or  in  connection  with  the  business  of	0	c
AHPL  and  which  is  not  generally  available  to  the  public;  and  all	0	c
copies,  reproductions  and  extracts  thereof,  in  any  format  or	0	c
manner of storage, whether in whole or in part, together with any	0	c
other  property  of  AHPL  made  or  acquired  by  the  other  party  or	0	c
coming  into  their  possession  or  control  in  any  manner	0	c
whatsoever.	58	s
(b)    All information as stated in Clause 1.2(a) above shall be and remain the	0	c
sole  property  of  the  Discloser  and  shall  be  returned  to  the  Discloser	0	c
forthwith  on  demand  at  any  time  or  without  demand  upon  the	0	c
termination of the other party's services.	0	s
(c)    The  Company  shall  ensure  that  none  of  the  patients  of  AHPL  can  be	0	c
identified in any reports, submissions and publications of the Company,	0	c
which shall be deemed to be Confidential information of AHPL within the	0	c
meaning  of  this  clause.  Confidential  Information  does  not  include	0	c
information:	0	d
(i)     which is or becomes public knowledge and public property in any	0	c
way without breach of this Agreement by the Recipient;	0	s
(ii)    which  the  Recipient  can  show  has  been  known  or  has  been	0	c
developed  by  or  for  the  Recipient  at  any  time  independently  of	0	c
the information disclosed to it by the Discloser;	0	s
(iii)  which  is  hereafter  disclosed  or  made  available  to  the  Recipient	0	c
from  a  source  other  than  the  Discloser  without  breach  by  the	0	c
Recipient  or  such  source  of  any  obligation  of  confidentiality  or	0	c
non-use towards the Discloser;	0	s
(iv)  which is hereafter made generally available by the Discloser or a	0	c
third party or is disclosed by the Discloser to a third party without	0	c
restriction  on  disclosure  or  use,  including  without  limitation,  by	0	c
way of the publication of a patent specification;	0	s
(v)    which  is  disclosed  orally  unless  it  is  identified  as  confidential  at	0	c
the  time  of  disclosure  and  confirmed  as  such  in  writing  by  the	0	c
Discloser within thirty (30) days of disclosure;	0	s
(vi)  which is disclosed by the Recipient with the prior written approval	0	c
of the Discloser; or	0	s
AHPL Non-Disclosure Agreement                                3                                                    NDA_01012014	0	e
(vii)   in  respect  of  which  a  period  of  five  (5)  years  has  elapsed  from	0	c
the date of signature of this Agreement	98	c
PROVIDED  HOWEVER  THAT the foregoing exceptions shall not apply	0	c
to information relating to any combination of features or any combination	0	c
of  items  of  information  merely  because  information  relating  to  one  or	0	c
more  of  the  relevant  individual  features  or  one  or  more  of  the  relevant	0	c
items (but not the combination itself) falls within any one or more of such	0	c
exceptions.	51	s
1.3  Notwithstanding  any  other  provision  to  the  contrary  in  this  Agreement,	0	c
any  information  relating  or  pertaining  to  the  patients  of  AHPL  shall  be	0	c
deemed to be Confidential Information of AHPL.	45	s
2.     HANDLING OF CONFIDENTIAL INFORMATION	0	d
2.1   In  consideration  of  the  mutual exchange  and  disclosure  of  Confidential	0	c
Information,  each  party  undertakes  in  relation  to  the  other  party's	0	c
Confidential Information:	0	d
(a)    to  maintain  the  same  in  confidence  and  to  use  it  only  for  the	0	c
Purpose  and  for  no  other  purpose  and  in  particular,  but  without	0	c
prejudice to the generality of the foregoing:	0	d
(i)     not to make any commercial use thereof;	0	s
(ii)    not to use the same for the benefit of itself or of any third	0	c
(3rd) party other than pursuant to a further agreement with	0	c
the other party; and	0	s
(iii)    not  to  use  the  same  for  the  purpose  of  guiding  or	0	c
conducting  a  search  of  any  information,  materials  or	0	c
sources,  whether  or  not  available  to  the  public,  for  any	0	c
purpose  whatsoever,  including  without  limitation,  for  the	0	c
purpose  of  demonstrating  that  any  information  falls  within	0	c
one (1) of the exceptions in Clause 1;	135	s
(b)    not  to  copy,  reproduce  or  reduce  to  writing  any  part  thereof	0	c
except as may be reasonably necessary for the Purpose and that	0	c
any  copies,  reproductions  or reductions  to  writing  so  made  shall	0	c
be the property of the Discloser;	0	s
(c)    not to disclose the same whether to its employees or to third (3rd)	0	c
parties  except  in  confidence  to  such  of  its  directors,  employees,	0	c
servants,   agents,   officers,   representatives,   consultants,	0	c
AHPL Non-Disclosure Agreement                                4                                                    NDA_01012014	0	e
independent  contractors  and  professional  advisors  who  need  to	0	c
know the same for the Purpose and that:	0	d
(i)     such  directors,  employees,  servants,  agents,  officers,	0	c
representatives,  consultants,  independent  contractors  and	0	c
professional  advisors  are  obliged  by  their  contracts  of	0	c
employment or service not to disclose the same; and	0	s
(ii)    the Recipient shall enforce such obligations at its expense	0	c
and  at  the  request  of  the  Discloser  in  so  far  as  breach	0	c
thereof relates to the Discloser's Confidential Information;	155	s
(d)    to be responsible for the performance of sub-clauses (a), (b) and	0	c
(c)  above  on  the  part  of  its  employees  or  directors  to  whom  the	0	c
same is disclosed pursuant to sub-clause (c) above; and	0	s
(e)    to apply thereto no lesser security measures and degree of care	0	c
than  those  which  the  Recipient  applies  to  its  own  confidential  or	0	c
proprietary  information  of  similar nature  and  which  the  Recipient	0	c
warrants  as  providing  adequate  protection  of  such  information	0	c
from unauthorised disclosure, copying or use.	132	s
2.2   The  Company  shall  cause  its  directors,  agents,  employees,  servants,	0	c
officers,  representatives,  consultants,  independent  contractors  and	0	c
professional advisors involved in the Purpose to observe or be similarly	0	c
bound by the terms of Agreement. The Company as the principal party	0	c
shall be responsible and held liable for any breach of this Agreement by	0	c
any  of  its  directors,  agents,  employees,  servants,  officers,	0	c
representatives,  consultants,  independent  contractors  and  professional	0	c
advisors.	0	s
2.3  Notwithstanding  the  foregoing,  the  Recipient  shall  be  entitled  to  make	0	c
any  disclosure  required  by  law  of  the  other  party's  Confidential	0	c
Information, but shall give the other party not less than two (2) business	0	c
days' notice of such disclosure and shall consult with the Discloser prior	0	c
to  such  disclosure  with  a  view  to  avoiding  such  disclosure  if  legally	0	c
possible.	129	s
3.     RETURN OF CONFIDENTIAL INFORMATION	0	d
Each party shall:	0	d
(a)    within one (1) month of completion of the purpose or receipt of a	0	c
written  request  from  the  other  party,  return  to  the  other  party  all	0	c
documents  and  materials  (and  all  copies  thereof)  containing  the	0	c
other party's Confidential Information and  certify  in  writing  to  the	0	c
AHPL Non-Disclosure Agreement                                5                                                    NDA_01012014	0	e
other party that it has complied with the requirements of this sub-	0	c
clause; and	0	s
(b)    notwithstanding  the  completion  of  the  Purpose  or  return  of  the	0	c
documents  and  materials as  aforesaid,  continue  to  be  bound  by	0	c
the undertakings set out in Clause 2.	185	s
4.     DATA PROTECTION	0	d
4.1  Any data provided by AHPL to the Company and used by the Company	0	c
directly or directly in the performance of this Agreement shall remain at	0	c
all times the property of AHPL.  It shall be identified, clearly marked and	0	c
recorded  as  such  by the  Company  on  all  media  and in  all	0	c
documentation.	0	s
4.2   The  Company  shall  take  all  reasonable  precautions  and  adequate	0	c
measures  to  preserve  the  integrity  and  prevent  any  corruption  or  loss,	0	c
damage or destruction of AHPL’s data.	0	s
4.3   In the event of termination of this Agreement,  the Company shall when	0	c
directed  to  do  so  by  AHPL,  and  instruct  all  its  agents  and  sub-	0	c
contractors to erase all data provided by AHPL and all copies of any part	0	c
of  the  data  provided  by  AHPL  from  the  Company’s  systems  and	0	c
magnetic data.	0	s
4.4  All data acquired by the Company from AHPL shall only be used for the	0	c
purposes  of  this  Agreement  and  shall  not  be  further  processed  or	0	c
disclosed without the prior consent of AHPL.	0	s
4.5   The  data  will  not  be  transferred  or  made  available  to  any  Third  (3rd)	0	c
Party without the prior written consent of AHPL.  The Company shall not	0	c
use any data provided by  AHPL,  or any  substance  that  is replicated  or	0	c
derived therefrom for any commercial or profit-generating purpose, or in	0	c
the  conduct  of  research  that  is  subject  to  consulting,  licensing  or  other	0	c
similar legal or commercial obligations to another institution, corporation	0	c
or business entity, unless the provider provides its prior written consent.	0	c
Upon  completion  of  this  Agreement,  the  data  will  be  either  returned  to	0	c
AHPL  or  disposed  of  under  the  Company’s  supervision  in  accordance	0	c
with the applicable laws and regulations, and the  written  instructions  of	0	c
AHPL.	0	s
4.6   The  parties  shall  comply  at  all  times  with  the  Personal  Data  Protection	0	c
Act 2012.	197	s
5.     DISCLAIMER AND WARRANTY	0	d
AHPL Non-Disclosure Agreement                                6                                                    NDA_01012014	0	e
5.1  Each  party  reserves  all  rights  in  its  Confidential  Information  and  no	0	c
rights or obligations other than those expressly recited here are granted	0	c
or to be implied from this Agreement. In particular, no licence is hereby	0	c
granted  directly  or  indirectly  under  any  patents,  patent  applications,	0	c
inventions,  discoveries,  copyrights  or  other  intellectual  property  rights	0	c
now or in the future held, made, obtained or licensable by either party.	0	s
5.2  Each  party  warrants  its  right  to  disclose  its  Confidential  Information  to	0	c
the other party and to authorise the other party to use the same for the	0	c
Purpose.	227	s
6.     CONFIDENTIALITY OF THIS AGREEMENT	0	d
Each party agrees to keep  the  existence  and  nature  of  this Agreement	0	c
confidential and not to use the same or the name of the other party or of	0	c
any other company in the Group of Companies of which the other party	0	c
forms part in any publicity, advertisement or other disclosure with regard	0	c
to  this  Agreement  without  the  prior  written  consent  of  the  other  party,	0	c
such consent not to be unreasonably withheld.	238	s
7.     DAMAGES NOT AN ADEQUATE REMEDY	0	d
The  Recipient  and  Discloser  both  acknowledge  that  the  Confidential	0	c
Information has been developed or obtained by one another through the	0	c
investment  of  significant  time,  effort  and  expense,  and  that  such	0	c
Confidential Information provides the other with a significant competitive	0	c
advantage  over  its  competitors.  The  Recipient  and  Discloser  both	0	c
understand  and  agree  that  any  breach  of  this  Agreement  will  result  in	0	c
irreparable  harm  to  the  Discloser  and  because  of  the  unique  nature  of	0	c
the  Confidential  Information,  monetary  damages  may  not  be  an	0	c
adequate remedy in the event of such a breach or threatened breach of	0	c
this Agreement. Accordingly, the Discloser and Recipient agree that the	0	c
Party seeking remedy shall be entitled to seek equitable relief, including	0	c
injunctive  relief  and  specific  performance,  in  the  event  of  a  breach  or	0	c
threatened  breach  of  this  Agreement  in  addition  to  all  other  remedies	0	c
available to the Party seeking remedy at law or in equity.	245	s
8.     NO GRANT OF INTELLECTUAL PROPERTY RIGHTS	0	d
8.1  All Confidential Information remains the property of the Discloser.	0	s
8.2   The Discloser reserves all rights  in  the  Confidential Information  and  no	0	c
rights  or  obligations  other  than  those  expressly  recited  herein  are	0	c
granted or to be implied from this Agreement. In particular, no license is	0	c
AHPL Non-Disclosure Agreement                                7                                                    NDA_01012014	0	e
hereby  granted  directly  or  indirectly  under  any  patent,  invention,	0	c
discovery, copyright or other industrial property right now or in the future	0	c
held, made, obtained or licensable by the Discloser.	0	s
8.3   The  Recipient  shall  not file  any  copyright  registrations,  patent	0	c
applications  or  similar  registrations  of  ownership  on  the  Confidential	0	c
Information.  In  the  event  that  the  Recipient  does  so  in  violation  of  this	0	c
Agreement,  the  Recipient  shall  assign  absolutely  to  the  Discloser  such	0	c
registrations and applications without any cost to the Discloser.	260	s
9.     LIMITATION OF LIABILITY	0	d
In  carrying  out  their  respective  obligations  under  this  Agreement,  the	0	c
Company  and  AHPL  shall  comply  with  all  laws  and  regulations	0	c
applicable thereto but save for wilful acts, default or gross negligence on	0	c
their respective parts, neither party shall be liable to the other party  for	0	c
any  indirect,  incidental,  special,  punitive  or  consequential  damages	0	c
however  caused,  including  any  loss  of  profits  or  business  interruption	0	c
costs  and  under  any  theory  of  liability,  including  but  not  limited  to	0	c
contract, strict liability and negligence; whether or not the other party has	0	c
been advised of the possibility of such damage.	274	s
10.  NOTICES	0	d
10.1  Except  as  otherwise  provided  in  this  Agreement,  notices  which  are	0	c
required  to  be  given  under  or  permitted  by  this  Agreement  shall  be  in	0	c
writing  (unless  expressly  stated  otherwise)  and  sent  to  the  address  of	0	c
the recipient set out in this Agreement. All notices may be sent by hand	0	c
or  by  AR  Registered  post  or  certified  mail,  return  receipt  requested,	0	c
postage prepaid and properly addressed to the offices of the parties as	0	c
specified  in  this  Agreement  or  to  such  other  address  as  the  party  may	0	c
later specify.	0	s
10.2  Every  notice  or  communication  so  sent  shall  be  deemed  to  have  been	0	c
properly  served  and  validly  made,  if  by  hand  when  delivered  to  the	0	c
recipient’s address or if sent by AR Registered post, two  (2) days  after	0	c
posting if posted to an address within Singapore and eight (8) days after	0	c
posting, if posted to an address outside Singapore, notwithstanding the	0	c
fact that the letter may be returned by the Post Office undelivered.	284	s
11.   TERMINATION	0	d
This Agreement shall continue to be in force from  the  date  hereof  until	0	c
terminated  by  mutual  consent  or  by  either  party  giving  to  the  other  not	0	c
AHPL Non-Disclosure Agreement                                8                                                    NDA_01012014	0	e
less than thirty (30) days’ prior written notice. The provision of Clauses 1	0	c
to 8, 11 to 15 and 17 to 21 shall survive any such termination.	299	s
12.  NON-ASSIGNMENT	0	d
Subject  to  the  other  provisions  of  this  Agreement,  all  the  terms  and	0	c
conditions  of  this  Agreement  shall  be  binding  upon  and  inure  to  the	0	c
benefit  of  the  parties  and  their  respective  permitted  assigns  and	0	c
successors-in-title except that:-	0	d
(i)     neither  party  shall  transfer  or  assign  all  or  any  of  its  rights,	0	c
obligations  or benefits  hereunder in  whole  or  in  part  to  any  third	0	c
(3rd)  party,  without  the  prior  written  consent  of  the  other  party,	0	c
which consent shall not be unreasonably withheld;	0	s
(ii)    any  permitted  assignee  or  transferee  shall  agree  in  writing  to	0	c
comply with all terms and conditions of this Agreement; and	0	s
(iii)    any  assignment  shall  not  exceed  the  existing  scope  of  this	0	c
Agreement.	305	s
13.  SEVERABILITY	0	d
13.1  In  the  event  that  any  term,  condition  or  provision  contained  in  this	0	c
Agreement  or  the  application  of  any  such  term,  condition  or  provision	0	c
shall  be  held  by  a  court of  competent  jurisdiction  to  be  wholly  or  partly	0	c
illegal, invalid, unenforceable or a violation of any applicable law, statute	0	c
or regulation of any jurisdiction, the same shall be deemed to be deleted	0	c
from  this  Agreement  and  shall  be  of  no  force  and  effect;  whereas  the	0	c
remaining  terms  and  provisions  of  this  Agreement  shall  remain  in  full	0	c
force  and  effect  as  if  such  term,  condition  and  provision  had  not	0	c
originally  been  contained  in  this  Agreement,  unless  the  severed	0	c
provisions  render the  continuing  performance  of this  Agreement	0	c
impossible, or materially change either party’s rights or obligations under	0	c
this Agreement; in which event such party may give written notice of its	0	c
intent to terminate this Agreement to the other party.	0	s
13.2  Notwithstanding the aforesaid, in the event of such deletion, the parties	0	c
hereto shall negotiate in good faith in order to agree to terms of mutually	0	c
acceptable  and  satisfactory  alternative  provisions  in  place  of  the	0	c
provision(s) so deleted.	318	s
14.  WAIVER	0	d
AHPL Non-Disclosure Agreement                                9                                                    NDA_01012014	0	e
14.1  No  waiver  of  any  breach  of  any  covenant,  condition,  stipulation,	0	c
obligation  or  provision  contained  or  implied  in  this  Agreement  shall	0	c
operate or be interpreted as a waiver of another breach  of the same or	0	c
of  any  covenant,  condition,  stipulation,  obligation  or  provision  in  this	0	c
Agreement.	0	s
14.2  Any  time  or  other  indulgence  granted  by  AHPL  under  this  Agreement	0	c
shall be without prejudice to and shall not be taken as a waiver of any of	0	c
AHPL’s rights under this Agreement nor shall it prejudice or in any way	0	c
limit or affect any statutory rights or powers from time to time vested in	0	c
or exercisable by AHPL.	336	s
15.  DISPUTE RESOLUTION	0	d
15.1  In the event of any dispute or difference arising out of or in connection	0	c
with  or  in  relation  to  this  Agreement  or  the  existence,  validity,	0	c
termination, application or interpretation of this Agreement  or any  of  its	0	c
provisions,  both  parties  shall  use  their  best  endeavours  to  settle  the	0	c
dispute informally by agreement  between the parties. Both parties shall	0	c
always act in good faith  and  co-operate  with  each  other to  resolve  any	0	c
disputes.	0	s
15.2  Notwithstanding anything in this Agreement, if the dispute is not settled	0	c
in  accordance  with  Clause  14.1  above,  no  party  shall  proceed  to	0	c
litigation or any other form of dispute resolution unless the parties have	0	c
made  reasonable  efforts  to  resolve  the  same  through  mediation  in	0	c
accordance with the mediation rules of the Singapore Mediation Centre.	0	c
A  party  who  receives  a  notice  for  mediation  from  the  other  party  shall	0	c
consent and participate in the mediation process in accordance with this	0	c
