jurisdiction  where  this  Agreement  has  been  breached  or  where  a  breach  is  threatened,  and  in	0	c
such  an  event,  the  Recipient  hereby  irrevocably  attorns  to  the  jurisdiction  of  the  Courts  of such	0	c
jurisdictions for the determination of all matters arising hereunder.	0	s
22.    This Agreement will continue indefinitely, unless otherwise agreed in writing by the Receiver.	0	s
23.    No waiver of any particular requirement hereunder shall be construed as a general waiver of this	0	c
Agreement,  and  any  failure  by  or  delay  by  the  Receiver  in  enforcing  its  rights  against  any	0	c
particular breach of this Agreement shall not  limit or affect its rights to enforce its rights against	0	c
any other breach hereof.	0	s
24.    This  Agreement  may  not  be  assigned  by  the  Recipient  without  the  prior  written  consent  of  the	0	c
Receiver.	0	s
25.    This  Agreement  shall  enure  to  the  benefit  of  the  Receiver  and  its  successors  and  assigns  and	0	c
shall be binding upon the Recipient and its successors and permitted assigns.	0	s
26.    This Agreement constitutes the entire agreement between the parties hereto and supersedes all	0	c
prior  contracts,  agreements  and  understandings  pertaining  to  the  subject  matter  of  this	0	c
Agreement.  No modification or alteration of this Agreement shall be binding unless executed in	0	c
writing by the parties hereto.  There are no representations, warranties, collateral agreements or	0	c
conditions affecting this transaction other than as are expressed or referred to herein in writing.	0	c
27.    Nothing contained in this Agreement shall in any way limit the rights or remedies available to the	0	c
Receiver at law, in equity or under statute arising in any way in connection with the disclosure of	0	c
the Confidentiality Information in the event of a breach or a threatened breach of this Agreement.	-1	s
31244051.4	0	e
- 8 -	0	e
IN  WITNESS  WHEREOF  the  parties  have  executed  this  Agreement  on  the  day  and  year  first	0	c
above written.	-1	s
FTI  CONSULTING  CANADA INC., in its	0	x
capacity  as  Receiver  and  Manager  of	0	x
Phenomenome    Discoveries    Inc.    and	0	x
Phenomenome  Laboratory  Services  Inc.,  and	0	x
not in its personal or corporate capacity,	0	x
Per:	0	x
______________________________________	0	x
Per:	0	x
Name of Recipient (please print)	0	x
Signature of Recipient and/or	0	x
Signing Officer	0	x
31244051.4	0	x
